Topic,Problem,Link,Problem_Name,Difficulty
Binary Trees,Check if Binary tree is Sum tree or not,https://www.geeksforgeeks.org/ ,Check if Binary tree is Sum tree or not,Hard
Binary Trees,Check if all leaf nodes are at same level or not,https://www.geeksforgeeks.org/ ,Check if all leaf nodes are at same level or not,Medium
Binary Trees,Check if a Binary Tree contains duplicate subtrees of size 2 or more [ IMP ],https://www.geeksforgeeks.org/ ,Check if a Binary Tree contains duplicate subtrees of size 2 or more [ IMP ],Hard
Binary Trees,Check if 2 trees are mirror or not,https://www.geeksforgeeks.org/ ,Check if 2 trees are mirror or not,Hard
Binary Trees,Sum of Nodes on the Longest path from root to leaf node ,https://www.geeksforgeeks.org/ ,Sum of Nodes on the Longest path from root to leaf node,Medium
Binary Trees,Check if given graph is tree or not.  [ IMP ],https://www.geeksforgeeks.org/ ,Check if given graph is tree or not.  [ IMP ],Hard
Binary Trees,Find Largest subtree sum in a tree,https://www.geeksforgeeks.org/ ,Find Largest subtree sum in a tree,Hard
Binary Trees,Maximum Sum of nodes in Binary tree such that no two are adjacent ,https://www.geeksforgeeks.org/ ,Maximum Sum of nodes in Binary tree such that no two are adjacent,Hard
Binary Trees,"Print all ""K"" Sum paths in a Binary tree",https://www.geeksforgeeks.org/ ,"Print all ""K"" Sum paths in a Binary tree",Hard
Binary Trees,Find LCA in a Binary tree,https://www.geeksforgeeks.org/ ,Find LCA in a Binary tree,Hard
Binary Trees,Find distance between 2 nodes in a Binary tree,https://www.geeksforgeeks.org/ ,Find distance between 2 nodes in a Binary tree,Hard
Binary Trees,Kth Ancestor of node in a Binary tree,https://www.geeksforgeeks.org/ ,Kth Ancestor of node in a Binary tree,Hard
Binary Trees,Find all Duplicate subtrees in a Binary tree [ IMP ],https://www.geeksforgeeks.org/ ,Find all Duplicate subtrees in a Binary tree [ IMP ],Hard
Binary Trees,Tree Isomorphism Problem,https://www.geeksforgeeks.org/ ,Tree Isomorphism Problem,Hard
,,https://www.geeksforgeeks.org/ ,nan,Medium
,,https://www.geeksforgeeks.org/ ,nan,Medium
Binary Search Trees,Fina a value in a BST,https://www.geeksforgeeks.org/ ,Fina a value in a BST,Medium
Binary Search Trees,Deletion of a node in a BST,https://www.geeksforgeeks.org/ ,Deletion of a node in a BST,Medium
Binary Search Trees,Find min and max value in a BST,https://www.geeksforgeeks.org/ ,Find min and max value in a BST,Medium
Binary Search Trees,Find inorder successor and inorder predecessor in a BST,https://www.geeksforgeeks.org/ ,Find inorder successor and inorder predecessor in a BST,Medium
Binary Search Trees,Check if a tree is a BST or not ,https://www.geeksforgeeks.org/ ,Check if a tree is a BST or not,Hard
Binary Search Trees,Populate Inorder successor of all nodes,https://www.geeksforgeeks.org/ ,Populate Inorder successor of all nodes,Medium
Binary Search Trees,Find LCA  of 2 nodes in a BST,https://www.geeksforgeeks.org/ ,Find LCA  of 2 nodes in a BST,Medium
Binary Search Trees,Construct BST from preorder traversal,https://www.geeksforgeeks.org/ ,Construct BST from preorder traversal,Medium
Binary Search Trees,Convert Binary tree into BST,https://www.geeksforgeeks.org/ ,Convert Binary tree into BST,Hard
Binary Search Trees,Convert a normal BST into a Balanced BST,https://www.geeksforgeeks.org/ ,Convert a normal BST into a Balanced BST,Medium
Binary Search Trees,Merge two BST [ V.V.V>IMP ],https://www.geeksforgeeks.org/ ,Merge two BST [ V.V.V>IMP ],Easy
Binary Search Trees,Find Kth largest element in a BST,https://www.geeksforgeeks.org/ ,Find Kth largest element in a BST,Medium
Binary Search Trees,Find Kth smallest element in a BST,https://www.geeksforgeeks.org/ ,Find Kth smallest element in a BST,Medium
Binary Search Trees,"Count pairs from 2 BST whose sum is equal to given value ""X""",https://www.geeksforgeeks.org/ ,"Count pairs from 2 BST whose sum is equal to given value ""X""",Medium
Binary Search Trees,Find the median of BST in O(n) time and O(1) space,https://www.geeksforgeeks.org/ ,Find the median of BST in O(n) time and O(1) space,Medium
Binary Search Trees,Count BST ndoes that lie in a given range,https://www.geeksforgeeks.org/ ,Count BST ndoes that lie in a given range,Medium
Binary Search Trees,Replace every element with the least greater element on its right,https://www.geeksforgeeks.org/ ,Replace every element with the least greater element on its right,Medium
Binary Search Trees,"Given ""n"" appointments, find the conflicting appointments",https://www.geeksforgeeks.org/ ,"Given ""n"" appointments, find the conflicting appointments",Medium
Binary Search Trees,Check preorder is valid or not,https://www.geeksforgeeks.org/ ,Check preorder is valid or not,Easy
Binary Search Trees,Check whether BST contains Dead end,https://www.geeksforgeeks.org/ ,Check whether BST contains Dead end,Medium
Binary Search Trees,Largest BST in a Binary Tree [ V.V.V.V.V IMP ],https://www.geeksforgeeks.org/ ,Largest BST in a Binary Tree [ V.V.V.V.V IMP ],Hard
Binary Search Trees,Flatten BST to sorted list,https://www.geeksforgeeks.org/ ,Flatten BST to sorted list,Medium
,,https://www.geeksforgeeks.org/ ,nan,Medium
,,https://www.geeksforgeeks.org/ ,nan,Medium
Greedy,Activity Selection Problem,https://www.geeksforgeeks.org/ ,Activity Selection Problem,Medium
Greedy,Job SequencingProblem,https://www.geeksforgeeks.org/ ,Job SequencingProblem,Medium
Greedy,Huffman Coding,https://www.geeksforgeeks.org/ ,Huffman Coding,Medium
Greedy,Water Connection Problem,https://www.geeksforgeeks.org/ ,Water Connection Problem,Medium
Greedy,Fractional Knapsack Problem,https://www.geeksforgeeks.org/ ,Fractional Knapsack Problem,Medium
Greedy,Greedy Algorithm to find Minimum number of Coins,https://www.geeksforgeeks.org/ ,Greedy Algorithm to find Minimum number of Coins,Medium
Greedy,Maximum trains for which stoppage can be provided,https://www.geeksforgeeks.org/ ,Maximum trains for which stoppage can be provided,Medium
Greedy,Minimum Platforms Problem,https://www.geeksforgeeks.org/ ,Minimum Platforms Problem,Medium
Greedy,Buy Maximum Stocks if i stocks can be bought on i-th day,https://www.geeksforgeeks.org/ ,Buy Maximum Stocks if i stocks can be bought on i-th day,Medium
Greedy,Find the minimum and maximum amount to buy all N candies,https://www.geeksforgeeks.org/ ,Find the minimum and maximum amount to buy all N candies,Medium
Greedy,Minimize Cash Flow among a given set of friends who have borrowed money from each other,https://www.geeksforgeeks.org/ ,Minimize Cash Flow among a given set of friends who have borrowed money from each other,Medium
Greedy,Minimum Cost to cut a board into squares,https://www.geeksforgeeks.org/ ,Minimum Cost to cut a board into squares,Medium
Greedy,Check if it is possible to survive on Island,https://www.geeksforgeeks.org/ ,Check if it is possible to survive on Island,Medium
Greedy,Find maximum meetings in one room,https://www.geeksforgeeks.org/ ,Find maximum meetings in one room,Medium
Greedy,Maximum product subset of an array,https://www.geeksforgeeks.org/ ,Maximum product subset of an array,Medium
Greedy,Maximize array sum after K negations,https://www.geeksforgeeks.org/ ,Maximize array sum after K negations,Medium
Greedy,Maximize the sum of arr[i]*i,https://www.geeksforgeeks.org/ ,Maximize the sum of arr[i]*i,Medium
Greedy,Maximum sum of absolute difference of an array,https://www.geeksforgeeks.org/ ,Maximum sum of absolute difference of an array,Medium
Greedy,Maximize sum of consecutive differences in a circular array,https://www.geeksforgeeks.org/ ,Maximize sum of consecutive differences in a circular array,Medium
Greedy,Minimum sum of absolute difference of pairs of two arrays,https://www.geeksforgeeks.org/ ,Minimum sum of absolute difference of pairs of two arrays,Medium
Greedy,Program for Shortest Job First (or SJF) CPU Scheduling,https://www.geeksforgeeks.org/ ,Program for Shortest Job First (or SJF) CPU Scheduling,Medium
Greedy,Program for Least Recently Used (LRU) Page Replacement algorithm,https://www.geeksforgeeks.org/ ,Program for Least Recently Used (LRU) Page Replacement algorithm,Medium
Greedy,Smallest subset with sum greater than all other elements,https://www.geeksforgeeks.org/ ,Smallest subset with sum greater than all other elements,Medium
Greedy,Chocolate Distribution Problem,https://www.geeksforgeeks.org/ ,Chocolate Distribution Problem,Medium
Greedy,DEFKIN -Defense of a Kingdom,https://www.geeksforgeeks.org/ ,DEFKIN -Defense of a Kingdom,Medium
Greedy,DIEHARD -DIE HARD,https://www.geeksforgeeks.org/ ,DIEHARD -DIE HARD,Medium
Greedy,GERGOVIA -Wine trading in Gergovia,https://www.geeksforgeeks.org/ ,GERGOVIA -Wine trading in Gergovia,Medium
Greedy,Picking Up Chicks,https://www.geeksforgeeks.org/ ,Picking Up Chicks,Medium
Greedy,CHOCOLA –Chocolate,https://www.geeksforgeeks.org/ ,CHOCOLA –Chocolate,Medium
Greedy,ARRANGE -Arranging Amplifiers,https://www.geeksforgeeks.org/ ,ARRANGE -Arranging Amplifiers,Medium
Greedy,K Centers Problem,https://www.geeksforgeeks.org/ ,K Centers Problem,Medium
Greedy,Minimum Cost of ropes,https://www.geeksforgeeks.org/ ,Minimum Cost of ropes,Medium
Greedy,Find smallest number with given number of digits and sum of digits,https://www.geeksforgeeks.org/ ,Find smallest number with given number of digits and sum of digits,Medium
Greedy,Rearrange characters in a string such that no two adjacent are same,https://www.geeksforgeeks.org/ ,Rearrange characters in a string such that no two adjacent are same,Medium
Greedy,Find maximum sum possible equal sum of three stacks,https://www.geeksforgeeks.org/ ,Find maximum sum possible equal sum of three stacks,Medium
,,https://www.geeksforgeeks.org/ ,nan,Medium
,,https://www.geeksforgeeks.org/ ,nan,Medium
BackTracking,Rat in a maze Problem,https://www.geeksforgeeks.org/ ,Rat in a maze Problem,Medium
BackTracking,Printing all solutions in N-Queen Problem,https://www.geeksforgeeks.org/ ,Printing all solutions in N-Queen Problem,Medium
BackTracking,Word Break Problem using Backtracking,https://www.geeksforgeeks.org/ ,Word Break Problem using Backtracking,Hard
BackTracking,Remove Invalid Parentheses,https://www.geeksforgeeks.org/ ,Remove Invalid Parentheses,Easy
BackTracking,Sudoku Solver,https://www.geeksforgeeks.org/ ,Sudoku Solver,Medium
BackTracking,m Coloring Problem,https://www.geeksforgeeks.org/ ,m Coloring Problem,Medium
BackTracking,Print all palindromic partitions of a string,https://www.geeksforgeeks.org/ ,Print all palindromic partitions of a string,Medium
BackTracking,Subset Sum Problem,https://www.geeksforgeeks.org/ ,Subset Sum Problem,Medium
BackTracking,The Knight’s tour problem,https://www.geeksforgeeks.org/ ,The Knight’s tour problem,Medium
BackTracking,Tug of War,https://www.geeksforgeeks.org/ ,Tug of War,Medium
BackTracking,Find shortest safe route in a path with landmines,https://www.geeksforgeeks.org/ ,Find shortest safe route in a path with landmines,Medium
BackTracking,Combinational Sum,https://www.geeksforgeeks.org/ ,Combinational Sum,Medium
BackTracking,Find Maximum number possible by doing at-most K swaps,https://www.geeksforgeeks.org/ ,Find Maximum number possible by doing at-most K swaps,Medium
BackTracking,Print all permutations of a string ,https://www.geeksforgeeks.org/ ,Print all permutations of a string,Medium
BackTracking,Find if there is a path of more than k length from a source,https://www.geeksforgeeks.org/ ,Find if there is a path of more than k length from a source,Medium
BackTracking,Longest Possible Route in a Matrix with Hurdles,https://www.geeksforgeeks.org/ ,Longest Possible Route in a Matrix with Hurdles,Hard
BackTracking,Print all possible paths from top left to bottom right of a mXn matrix,https://www.geeksforgeeks.org/ ,Print all possible paths from top left to bottom right of a mXn matrix,Hard
BackTracking,Partition of a set intoK subsets with equal sum,https://www.geeksforgeeks.org/ ,Partition of a set intoK subsets with equal sum,Medium
BackTracking,Find the K-th Permutation Sequence of first N natural numbers,https://www.geeksforgeeks.org/ ,Find the K-th Permutation Sequence of first N natural numbers,Medium
,,https://www.geeksforgeeks.org/ ,nan,Medium
,,https://www.geeksforgeeks.org/ ,nan,Medium
Stacks & Queues, Implement Stack from Scratch,https://www.geeksforgeeks.org/ ,Implement Stack from Scratch,Medium
Stacks & Queues, Implement Queue from Scratch,https://www.geeksforgeeks.org/ ,Implement Queue from Scratch,Medium
Stacks & Queues,Implement 2 stack in an array,https://www.geeksforgeeks.org/ ,Implement 2 stack in an array,Medium
Stacks & Queues,find the middle element of a stack,https://www.geeksforgeeks.org/ ,find the middle element of a stack,Medium
Stacks & Queues,"Implement ""N"" stacks in an Array",https://www.geeksforgeeks.org/ ,"Implement ""N"" stacks in an Array",Medium
Stacks & Queues,Check the expression has valid or Balanced parenthesis or not.,https://www.geeksforgeeks.org/ ,Check the expression has valid or Balanced parenthesis or not.,Easy
Stacks & Queues,Reverse a String using Stack,https://www.geeksforgeeks.org/ ,Reverse a String using Stack,Easy
Stacks & Queues,Design a Stack that supports getMin() in O(1) time and O(1) extra space.,https://www.geeksforgeeks.org/ ,Design a Stack that supports getMin() in O(1) time and O(1) extra space.,Medium
Stacks & Queues,Find the next Greater element,https://www.geeksforgeeks.org/ ,Find the next Greater element,Medium
Stacks & Queues,The celebrity Problem,https://www.geeksforgeeks.org/ ,The celebrity Problem,Medium
Stacks & Queues,Arithmetic Expression evaluation,https://www.geeksforgeeks.org/ ,Arithmetic Expression evaluation,Medium
Stacks & Queues,Evaluation of Postfix expression,https://www.geeksforgeeks.org/ ,Evaluation of Postfix expression,Medium
Stacks & Queues,Implement a method to insert an element at its bottom without using any other data structure.,https://www.geeksforgeeks.org/ ,Implement a method to insert an element at its bottom without using any other data structure.,Medium
Stacks & Queues,Reverse a stack using recursion,https://www.geeksforgeeks.org/ ,Reverse a stack using recursion,Easy
Stacks & Queues,Sort a Stack using recursion,https://www.geeksforgeeks.org/ ,Sort a Stack using recursion,Medium
Stacks & Queues,Merge Overlapping Intervals,https://www.geeksforgeeks.org/ ,Merge Overlapping Intervals,Easy
Stacks & Queues,Largest rectangular Area in Histogram,https://www.geeksforgeeks.org/ ,Largest rectangular Area in Histogram,Medium
Stacks & Queues,Length of the Longest Valid Substring,https://www.geeksforgeeks.org/ ,Length of the Longest Valid Substring,Easy
Stacks & Queues,Expression contains redundant bracket or not,https://www.geeksforgeeks.org/ ,Expression contains redundant bracket or not,Medium
Stacks & Queues,Implement Stack using Queue,https://www.geeksforgeeks.org/ ,Implement Stack using Queue,Medium
Stacks & Queues,Implement Stack using Deque,https://www.geeksforgeeks.org/ ,Implement Stack using Deque,Medium
Stacks & Queues,Stack Permutations (Check if an array is stack permutation of other),https://www.geeksforgeeks.org/ ,Stack Permutations (Check if an array is stack permutation of other),Medium
Stacks & Queues,Implement Queue using Stack  ,https://www.geeksforgeeks.org/ ,Implement Queue using Stack,Medium
Stacks & Queues,"Implement ""n"" queue in an array",https://www.geeksforgeeks.org/ ,"Implement ""n"" queue in an array",Medium
Stacks & Queues,Implement a Circular queue,https://www.geeksforgeeks.org/ ,Implement a Circular queue,Medium
Stacks & Queues,LRU Cache Implementationa,https://www.geeksforgeeks.org/ ,LRU Cache Implementationa,Medium
Stacks & Queues,Reverse a Queue using recursion,https://www.geeksforgeeks.org/ ,Reverse a Queue using recursion,Easy
Stacks & Queues,Reverse the first “K” elements of a queue,https://www.geeksforgeeks.org/ ,Reverse the first “K” elements of a queue,Easy
Stacks & Queues,Interleave the first half of the queue with second half,https://www.geeksforgeeks.org/ ,Interleave the first half of the queue with second half,Medium
Stacks & Queues,Find the first circular tour that visits all Petrol Pumps,https://www.geeksforgeeks.org/ ,Find the first circular tour that visits all Petrol Pumps,Medium
Stacks & Queues,Minimum time required to rot all oranges,https://www.geeksforgeeks.org/ ,Minimum time required to rot all oranges,Medium
Stacks & Queues,Distance of nearest cell having 1 in a binary matrix,https://www.geeksforgeeks.org/ ,Distance of nearest cell having 1 in a binary matrix,Hard
Stacks & Queues,First negative integer in every window of size “k”,https://www.geeksforgeeks.org/ ,First negative integer in every window of size “k”,Medium
Stacks & Queues,Check if all levels of two trees are anagrams or not.,https://www.geeksforgeeks.org/ ,Check if all levels of two trees are anagrams or not.,Hard
Stacks & Queues,Sum of minimum and maximum elements of all subarrays of size “k”.,https://www.geeksforgeeks.org/ ,Sum of minimum and maximum elements of all subarrays of size “k”.,Medium
Stacks & Queues,Minimum sum of squares of character counts in a given string after removing “k” characters.,https://www.geeksforgeeks.org/ ,Minimum sum of squares of character counts in a given string after removing “k” characters.,Medium
Stacks & Queues,Queue based approach or first non-repeating character in a stream.,https://www.geeksforgeeks.org/ ,Queue based approach or first non-repeating character in a stream.,Medium
Stacks & Queues,Next Smaller Element,https://www.geeksforgeeks.org/ ,Next Smaller Element,Medium
,,https://www.geeksforgeeks.org/ ,nan,Medium
,,https://www.geeksforgeeks.org/ ,nan,Medium
Heap,Implement a Maxheap/MinHeap using arrays and recursion.,https://www.geeksforgeeks.org/ ,Implement a Maxheap/MinHeap using arrays and recursion.,Medium
Heap,Sort an Array using heap. (HeapSort),https://www.geeksforgeeks.org/ ,Sort an Array using heap. (HeapSort),Medium
Heap,Maximum of all subarrays of size k.,https://www.geeksforgeeks.org/ ,Maximum of all subarrays of size k.,Medium
Heap,“k” largest element in an array,https://www.geeksforgeeks.org/ ,“k” largest element in an array,Medium
Heap,Kth smallest and largest element in an unsorted array,https://www.geeksforgeeks.org/ ,Kth smallest and largest element in an unsorted array,Medium
Heap,Merge “K” sorted arrays. [ IMP ],https://www.geeksforgeeks.org/ ,Merge “K” sorted arrays. [ IMP ],Easy
Heap,Merge 2 Binary Max Heaps,https://www.geeksforgeeks.org/ ,Merge 2 Binary Max Heaps,Easy
Heap,Kth largest sum continuous subarrays,https://www.geeksforgeeks.org/ ,Kth largest sum continuous subarrays,Medium
Heap,Leetcode- reorganize strings,https://www.geeksforgeeks.org/ ,Leetcode- reorganize strings,Medium
Heap,Merge “K” Sorted Linked Lists [V.IMP],https://www.geeksforgeeks.org/ ,Merge “K” Sorted Linked Lists [V.IMP],Easy
Heap,Smallest range in “K” Lists,https://www.geeksforgeeks.org/ ,Smallest range in “K” Lists,Medium
Heap,Median in a stream of Integers,https://www.geeksforgeeks.org/ ,Median in a stream of Integers,Medium
Heap,Check if a Binary Tree is Heap,https://www.geeksforgeeks.org/ ,Check if a Binary Tree is Heap,Hard
Heap,Connect “n” ropes with minimum cost,https://www.geeksforgeeks.org/ ,Connect “n” ropes with minimum cost,Medium
Heap,Convert BST to Min Heap,https://www.geeksforgeeks.org/ ,Convert BST to Min Heap,Medium
Heap,Convert min heap to max heap,https://www.geeksforgeeks.org/ ,Convert min heap to max heap,Medium
Heap,Rearrange characters in a string such that no two adjacent are same.,https://www.geeksforgeeks.org/ ,Rearrange characters in a string such that no two adjacent are same.,Medium
Heap,Minimum sum of two numbers formed from digits of an array,https://www.geeksforgeeks.org/ ,Minimum sum of two numbers formed from digits of an array,Medium
,,https://www.geeksforgeeks.org/ ,nan,Medium
,,https://www.geeksforgeeks.org/ ,nan,Medium
Graph,"Create a Graph, print it",https://www.geeksforgeeks.org/ ,"Create a Graph, print it",Hard
Graph,Implement BFS algorithm ,https://www.geeksforgeeks.org/ ,Implement BFS algorithm,Medium
Graph,Implement DFS Algo ,https://www.geeksforgeeks.org/ ,Implement DFS Algo,Medium
Graph,Detect Cycle in Directed Graph using BFS/DFS Algo ,https://www.geeksforgeeks.org/ ,Detect Cycle in Directed Graph using BFS/DFS Algo,Hard
Graph,Detect Cycle in UnDirected Graph using BFS/DFS Algo ,https://www.geeksforgeeks.org/ ,Detect Cycle in UnDirected Graph using BFS/DFS Algo,Hard
Graph,Search in a Maze,https://www.geeksforgeeks.org/ ,Search in a Maze,Medium
Graph,Minimum Step by Knight,https://www.geeksforgeeks.org/ ,Minimum Step by Knight,Medium
Graph,flood fill algo,https://www.geeksforgeeks.org/ ,flood fill algo,Medium
Graph,Clone a graph,https://www.geeksforgeeks.org/ ,Clone a graph,Hard
Graph,Making wired Connections,https://www.geeksforgeeks.org/ ,Making wired Connections,Medium
Graph,word Ladder ,https://www.geeksforgeeks.org/ ,word Ladder,Medium
Graph,Dijkstra algo,https://www.geeksforgeeks.org/ ,Dijkstra algo,Medium
Graph,Implement Topological Sort ,https://www.geeksforgeeks.org/ ,Implement Topological Sort,Medium
Graph,Minimum time taken by each job to be completed given by a Directed Acyclic Graph,https://www.geeksforgeeks.org/ ,Minimum time taken by each job to be completed given by a Directed Acyclic Graph,Hard
Graph,Find whether it is possible to finish all tasks or not from given dependencies,https://www.geeksforgeeks.org/ ,Find whether it is possible to finish all tasks or not from given dependencies,Medium
Graph,Find the no. of Isalnds,https://www.geeksforgeeks.org/ ,Find the no. of Isalnds,Medium
Graph,"Given a sorted Dictionary of an Alien Language, find order of characters",https://www.geeksforgeeks.org/ ,"Given a sorted Dictionary of an Alien Language, find order of characters",Medium
Graph,Implement Kruksal’sAlgorithm,https://www.geeksforgeeks.org/ ,Implement Kruksal’sAlgorithm,Medium
Graph,Implement Prim’s Algorithm,https://www.geeksforgeeks.org/ ,Implement Prim’s Algorithm,Medium
Graph,Total no. of Spanning tree in a graph,https://www.geeksforgeeks.org/ ,Total no. of Spanning tree in a graph,Hard
Graph,Implement Bellman Ford Algorithm,https://www.geeksforgeeks.org/ ,Implement Bellman Ford Algorithm,Medium
Graph,Implement Floyd warshallAlgorithm,https://www.geeksforgeeks.org/ ,Implement Floyd warshallAlgorithm,Medium
Graph,Travelling Salesman Problem,https://www.geeksforgeeks.org/ ,Travelling Salesman Problem,Medium
Graph,Graph ColouringProblem,https://www.geeksforgeeks.org/ ,Graph ColouringProblem,Hard
Graph,Snake and Ladders Problem,https://www.geeksforgeeks.org/ ,Snake and Ladders Problem,Medium
Graph,Find bridge in a graph,https://www.geeksforgeeks.org/ ,Find bridge in a graph,Hard
Graph,Count Strongly connected Components(Kosaraju Algo),https://www.geeksforgeeks.org/ ,Count Strongly connected Components(Kosaraju Algo),Medium
Graph,Check whether a graph is Bipartite or Not,https://www.geeksforgeeks.org/ ,Check whether a graph is Bipartite or Not,Hard
Graph,Detect Negative cycle in a graph,https://www.geeksforgeeks.org/ ,Detect Negative cycle in a graph,Hard
Graph,Longest path in a Directed Acyclic Graph,https://www.geeksforgeeks.org/ ,Longest path in a Directed Acyclic Graph,Hard
Graph,Journey to the Moon,https://www.geeksforgeeks.org/ ,Journey to the Moon,Medium
Graph,Cheapest Flights Within K Stops,https://www.geeksforgeeks.org/ ,Cheapest Flights Within K Stops,Medium
Graph,Oliver and the Game,https://www.geeksforgeeks.org/ ,Oliver and the Game,Medium
Graph,Water Jug problem using BFS,https://www.geeksforgeeks.org/ ,Water Jug problem using BFS,Medium
Graph,Water Jug problem using BFS,https://www.geeksforgeeks.org/ ,Water Jug problem using BFS,Medium
Graph,Find if there is a path of more thank length from a source,https://www.geeksforgeeks.org/ ,Find if there is a path of more thank length from a source,Medium
Graph,M-ColouringProblem,https://www.geeksforgeeks.org/ ,M-ColouringProblem,Medium
Graph,Minimum edges to reverse o make path from source to destination,https://www.geeksforgeeks.org/ ,Minimum edges to reverse o make path from source to destination,Easy
Graph,Paths to travel each nodes using each edge(Seven Bridges),https://www.geeksforgeeks.org/ ,Paths to travel each nodes using each edge(Seven Bridges),Medium
Graph,Vertex Cover Problem,https://www.geeksforgeeks.org/ ,Vertex Cover Problem,Medium
Graph,Chinese Postman or Route Inspection,https://www.geeksforgeeks.org/ ,Chinese Postman or Route Inspection,Medium
Graph,Number of Triangles in a Directed and Undirected Graph,https://www.geeksforgeeks.org/ ,Number of Triangles in a Directed and Undirected Graph,Hard
Graph,Minimise the cashflow among a given set of friends who have borrowed money from each other,https://www.geeksforgeeks.org/ ,Minimise the cashflow among a given set of friends who have borrowed money from each other,Medium
Graph,Two Clique Problem,https://www.geeksforgeeks.org/ ,Two Clique Problem,Medium
,,https://www.geeksforgeeks.org/ ,nan,Medium
,,https://www.geeksforgeeks.org/ ,nan,Medium
Trie,Construct a trie from scratch,https://www.geeksforgeeks.org/ ,Construct a trie from scratch,Medium
Trie,Find shortest unique prefix for every word in a given list,https://www.geeksforgeeks.org/ ,Find shortest unique prefix for every word in a given list,Medium
Trie,Word Break Problem | (Trie solution),https://www.geeksforgeeks.org/ ,Word Break Problem | (Trie solution),Medium
Trie,"Given a sequence of words, print all anagrams together",https://www.geeksforgeeks.org/ ,"Given a sequence of words, print all anagrams together",Medium
